{
  "schema": "goc_g9_experience_score_matrix_v1",
  "roadmap_reference": "docs/ROADMAP_MVP_GoC.md section 6.9",
  "audit_run_id": "",
  "scorer_role": "",
  "scored_at_utc": "",
  "criteria": [
    "dramatic_responsiveness",
    "truth_consistency",
    "character_credibility",
    "conflict_continuity",
    "graceful_degradation"
  ],
  "scenarios": [
    {
      "scenario_id": "goc_roadmap_s1_direct_provocation",
      "failure_oriented": false,
      "automated_trace_anchor": "",
      "scores": {
        "dramatic_responsiveness": null,
        "truth_consistency": null,
        "character_credibility": null,
        "conflict_continuity": null,
        "graceful_degradation": null
      },
      "cell_rationale": {
        "dramatic_responsiveness": "",
        "truth_consistency": "",
        "character_credibility": "",
        "conflict_continuity": "",
        "graceful_degradation": ""
      }
    },
    {
      "scenario_id": "goc_roadmap_s2_deflection_brevity",
      "failure_oriented": false,
      "automated_trace_anchor": "",
      "scores": {
        "dramatic_responsiveness": null,
        "truth_consistency": null,
        "character_credibility": null,
        "conflict_continuity": null,
        "graceful_degradation": null
      },
      "cell_rationale": {}
    },
    {
      "scenario_id": "goc_roadmap_s3_pressure_escalation",
      "failure_oriented": false,
      "automated_trace_anchor": "",
      "scores": {
        "dramatic_responsiveness": null,
        "truth_consistency": null,
        "character_credibility": null,
        "conflict_continuity": null,
        "graceful_degradation": null
      },
      "cell_rationale": {}
    },
    {
      "scenario_id": "goc_roadmap_s4_misinterpretation_correction",
      "failure_oriented": false,
      "automated_trace_anchor": "",
      "scores": {
        "dramatic_responsiveness": null,
        "truth_consistency": null,
        "character_credibility": null,
        "conflict_continuity": null,
        "graceful_degradation": null
      },
      "cell_rationale": {}
    },
    {
      "scenario_id": "goc_roadmap_s5_primary_failure_fallback",
      "failure_oriented": true,
      "automated_trace_anchor": "",
      "scores": {
        "dramatic_responsiveness": null,
        "truth_consistency": null,
        "character_credibility": null,
        "conflict_continuity": null,
        "graceful_degradation": null
      },
      "cell_rationale": {}
    },
    {
      "scenario_id": "goc_roadmap_s6_retrieval_heavy",
      "failure_oriented": false,
      "automated_trace_anchor": "trace-roadmap-s6-retrieval-heavy",
      "scores": {
        "dramatic_responsiveness": null,
        "truth_consistency": null,
        "character_credibility": null,
        "conflict_continuity": null,
        "graceful_degradation": null
      },
      "cell_rationale": {}
    }
  ],
  "threshold_check": {
    "computed": false,
    "notes": "Fill scores, then run scripts/g9_threshold_validator.py"
  }
}
